[
  {
    "schema_version": "1.0.0",
    "observation_id": "synthetic-application-001",
    "repository_type": "enterprise_application",
    "repository_reference": "evaluations/representative-repositories/application",
    "assessment_id": "assessment-application-001",
    "provenance_verifiable": true,
    "seeded_or_validated_scenarios": 2,
    "confirmed_scenarios_detected": 2,
    "findings_reviewed": 3,
    "false_positives": 0,
    "review_minutes": 20,
    "human_review_minutes": 10,
    "risky_changes": 1,
    "risky_changes_block_recommended": 1,
    "remediation_minutes": 30,
    "recovery_minutes": 45,
    "reusable_controls_created": 1,
    "notes": ["Synthetic example; not a measured pilot result."],
    "observed_at": "2026-09-25T12:00:00Z"
  },
  {
    "schema_version": "1.0.0",
    "observation_id": "synthetic-infrastructure-001",
    "repository_type": "infrastructure",
    "repository_reference": "evaluations/representative-repositories/infrastructure",
    "assessment_id": "assessment-infrastructure-001",
    "provenance_verifiable": true,
    "seeded_or_validated_scenarios": 2,
    "confirmed_scenarios_detected": 2,
    "findings_reviewed": 2,
    "false_positives": 0,
    "review_minutes": 18,
    "human_review_minutes": 12,
    "risky_changes": 1,
    "risky_changes_block_recommended": 1,
    "remediation_minutes": 40,
    "recovery_minutes": 50,
    "reusable_controls_created": 2,
    "notes": ["Synthetic example; not a measured pilot result."],
    "observed_at": "2026-09-25T12:05:00Z"
  },
  {
    "schema_version": "1.0.0",
    "observation_id": "synthetic-ai-agent-001",
    "repository_type": "ai_agent",
    "repository_reference": "evaluations/representative-repositories/ai-agent",
    "assessment_id": "assessment-ai-agent-001",
    "provenance_verifiable": false,
    "seeded_or_validated_scenarios": 2,
    "confirmed_scenarios_detected": 1,
    "findings_reviewed": 3,
    "false_positives": 1,
    "review_minutes": 30,
    "human_review_minutes": 20,
    "risky_changes": 1,
    "risky_changes_block_recommended": 1,
    "remediation_minutes": 60,
    "recovery_minutes": 90,
    "reusable_controls_created": 1,
    "notes": ["Synthetic example; not a measured pilot result."],
    "observed_at": "2026-09-25T12:10:00Z"
  }
]

